{
  "jurisdiction": "legis-federal",
  "window_start": "2025-01-01",
  "window_end": "2026-08-13",
  "reviewed_date": "2026-08-13",
  "coverage": {
    "sources_searched": [
      "https://www.congress.gov (enacted public laws, 119th Congress)",
      "https://www.irs.gov/newsroom"
    ],
    "gaps": [
      "DEMO DATA: produced without network access. Entries are AI-recalled from the One Big Beautiful Bill Act (P.L. 119-21, enacted 2025-07-04) and marked unverified; excerpts are illustrative, not verbatim bill text. Re-run the legis-federal agent in a network-enabled session to verify against congress.gov."
    ]
  },
  "laws": [
    {
      "id": "obbba-domestic-business-provisions",
      "bill": "H.R. 1, 119th Congress (One Big Beautiful Bill Act)",
      "law_citation": "P.L. 119-21",
      "title": "OBBBA domestic business provisions: §174A expensing, 100% bonus, §163(j) EBITDA",
      "enacted_date": "2025-07-04",
      "effective": "Generally tax years beginning after December 31, 2024; bonus depreciation for property acquired after January 19, 2025; elective §174A retroactivity to 2022 for small-business taxpayers.",
      "stage": "enacted",
      "category": "income-or-deduction",
      "impact": "high",
      "status": "unverified",
      "summary_for_company": "Starting with the 2025 return, domestic R&E is deductible again under new Section 174A (foreign R&E stays on 15-year amortization), 100% bonus depreciation applies to property acquired after January 19, 2025, and the Section 163(j) limitation reverts to an EBITDA base. Decide deduct-vs-amortize for R&E, revisit any capitalized 2022-2024 domestic R&E for the catch-up/method-change options under Rev. Proc. 2025-28, and refresh the Form 8990 model since the higher ATI base may free previously carried-forward interest. The provision team should also re-project deferred taxes for the restored deductions.",
      "summary_for_firm": "Every corporate client with R&E, capex, or leveraged capital structures is affected beginning with 2025 returns. Small-business clients (average gross receipts under roughly $31M) can elect to apply Section 174A retroactively to 2022-2024 — triage the client list now for amended-return/refund opportunities. Capex-heavy clients need acquisition-date tracking around January 19, 2025 for the 100%-vs-40% bonus split, and clients with disallowed interest carryforwards should be modeled under the restored EBITDA base before extensions are calendared.",
      "affected_returns": ["Form 1120", "Form 4562", "Form 8990", "Form 4626"],
      "related_form_jurisdictions": ["federal-1120"],
      "first_return_year_affected": 2025,
      "source": {
        "document": "One Big Beautiful Bill Act, P.L. 119-21",
        "url": "https://www.congress.gov/bill/119th-congress/house-bill/1",
        "section": "Secs. 70301-70307 (Title VII)",
        "page": ""
      },
      "excerpt": {
        "passage": "[ILLUSTRATIVE — verify against enrolled bill text] SEC. 70302. FULL EXPENSING OF DOMESTIC RESEARCH AND EXPERIMENTAL EXPENDITURES. (a) IN GENERAL. — Part VI of subchapter B of chapter 1 is amended by inserting after section 174 the following new section: 'SEC. 174A. DOMESTIC RESEARCH AND EXPERIMENTAL EXPENDITURES. (a) IN GENERAL. — Notwithstanding section 263, there shall be allowed as a deduction any domestic research or experimental expenditures which are paid or incurred by the taxpayer during the taxable year.'",
        "amended_from": "Section 174(a)(2)(B) (as in effect for taxable years beginning after December 31, 2021): 'shall be allowed as an amortization deduction ratably over the 5-year period (15-year period in the case of any specified research or experimental expenditures which are attributable to foreign research)…'"
      }
    },
    {
      "id": "obbba-international-provisions",
      "bill": "H.R. 1, 119th Congress (One Big Beautiful Bill Act)",
      "law_citation": "P.L. 119-21",
      "title": "OBBBA international overhaul: GILTI becomes NCTI, FDII becomes FDDEI, §250 rates reset",
      "enacted_date": "2025-07-04",
      "effective": "Generally tax years beginning after December 31, 2025.",
      "stage": "enacted",
      "category": "definition-change",
      "impact": "high",
      "status": "unverified",
      "summary_for_company": "For tax years beginning after 2025, the GILTI regime is renamed net CFC tested income (NCTI) with the QBAI-based deemed tangible income return eliminated, the FDII deduction becomes FDDEI, Section 250 deduction percentages are reset, and the deemed-paid credit haircut on tested income moves to 90%. Model the 2026 effective-rate impact now, expect Form 5471 Schedule I-1 and Form 8993 to be substantially revised, and revisit expense-apportionment positions since the computation base changes.",
      "summary_for_firm": "Clients with CFCs or export income face a materially different international computation starting with 2026 returns, and 2025-2026 provision work must reflect enacted-law rates today. Flag every client filing Forms 5471/8992/8993, quantify the loss of the QBAI exclusion (capital-intensive foreign operations are hit hardest), and brief clients that prior GILTI planning built around deemed tangible income returns no longer works. Watch for revised IRS forms and update organizers accordingly.",
      "affected_returns": ["Form 5471 Sch. I-1", "Form 8992", "Form 8993", "Form 1120 Sch. C", "Form 1118"],
      "related_form_jurisdictions": ["federal-5471", "federal-1120"],
      "first_return_year_affected": 2026,
      "source": {
        "document": "One Big Beautiful Bill Act, P.L. 119-21",
        "url": "https://www.congress.gov/bill/119th-congress/house-bill/1",
        "section": "Secs. 70311-70323 (Title VII)",
        "page": ""
      },
      "excerpt": {
        "passage": "[ILLUSTRATIVE — verify against enrolled bill text] SEC. 70312. MODIFICATIONS TO DETERMINATION OF NET CFC TESTED INCOME. (a) REPEAL OF TANGIBLE INCOME EXCLUSION. — Section 951A(b) is amended… (b) CONFORMING CHANGE OF NAME. — The term 'global intangible low-taxed income' is stricken each place it appears and replaced with 'net CFC tested income'.",
        "amended_from": "Section 951A(b)(1): 'The term \"global intangible low-taxed income\" means, with respect to any United States shareholder for any taxable year of such United States shareholder, the excess (if any) of — (A) such shareholder's net CFC tested income for such taxable year, over (B) such shareholder's net deemed tangible income return for such taxable year.'"
      }
    }
  ]
}
